{
  "bindingVersion": "1",
  "kind": "camera-asset",
  "maturity": "integration-verified",
  "connectionId": "6f1b6a0e-6b0e-4f3f-9d0a-2a1f7c9e5b01",
  "projectId": "0a2f1c5d-7e44-4a1b-9c31-1d8b6e5f4a22",
  "siteId": "3c9e7b21-5d18-4c6a-8f52-9b0d2e4a7c13",
  "assetId": "b7d4e9a1-2c38-4f57-9a6b-8e1c3d5f7024",
  "external": {
    "product": "vistacast",
    "tenantId": "vc-tenant-7421",
    "cameraId": "cam-dock-north-02",
    "displayName": "北侧月台摄像头"
  },
  "autoActionEnabled": false,
  "createdAt": "2026-09-06T02:14:31Z",
  "createdBy": "operator@example.com"
}
